date,event,source,start_date,end_date
550000000,"First fossil evidence for Ctenophora (comb jellies), Porifera (sponges), Anthozoa (corals and sea anemones)",https://en.wikipedia.org/wiki/Timeline_of_the_evolutionary_history_of_life,550000000,550000000
56000000,"Gastornis, a large flightless bird, appears in the fossil record",https://en.wikipedia.org/wiki/Timeline_of_the_evolutionary_history_of_life,56000000,56000000
540000000,Most modern phyla of animals begin to appear in the fossil record during the Cambrian explosion.[56][57],https://en.wikipedia.org/wiki/Timeline_of_the_evolutionary_history_of_life,540000000,540000000
561000000,"The Ediacara biota represent the first large, complex aquatic multicellular organisms — although their affinities remain a subject of debate.[55]",https://en.wikipedia.org/wiki/Timeline_of_the_evolutionary_history_of_life,561000000,561000000
59000000,Earliest sailfish appear,https://en.wikipedia.org/wiki/Timeline_of_the_evolutionary_history_of_life,59000000,59000000
6000000,"Australopithecines diversify (Orrorin, Ardipithecus)",https://en.wikipedia.org/wiki/Timeline_of_the_evolutionary_history_of_life,6000000,6000000
6500000,First hominins (Sahelanthropus),https://en.wikipedia.org/wiki/Timeline_of_the_evolutionary_history_of_life,6500000,6500000
60000000,"Diversification of large, flightless birds. Earliest true primates,[who?] along with the first semelid bivalves, edentate, carnivoran and lipotyphlan mammals, and owls. The ancestors of the carnivorous mammals (miacids) were alive.[citation needed]",https://en.wikipedia.org/wiki/Timeline_of_the_evolutionary_history_of_life,60000000,60000000
600000000,"The accumulation of atmospheric oxygen allows the formation of an ozone layer.[54] Prior to this, land-based life would probably have required other chemicals to attenuate ultraviolet radiation enough to permit colonisation of the land.[38]",https://en.wikipedia.org/wiki/Timeline_of_the_evolutionary_history_of_life,600000000,600000000
600000,Evolution of Homo heidelbergensis,https://en.wikipedia.org/wiki/Timeline_of_the_evolutionary_history_of_life,600000,600000
6000,Small populations of American mastodon die off in places like Utah and Michigan,https://en.wikipedia.org/wiki/Timeline_of_the_evolutionary_history_of_life,6000,6000
62000000,Evolution of the first penguins,https://en.wikipedia.org/wiki/Timeline_of_the_evolutionary_history_of_life,62000000,62000000
63000000,"Evolution of the creodonts, an important group of meat-eating (carnivorous) mammals",https://en.wikipedia.org/wiki/Timeline_of_the_evolutionary_history_of_life,63000000,63000000
66000000,"The Cretaceous–Paleogene extinction event eradicates about half of all animal species, including mosasaurs, pterosaurs, plesiosaurs, ammonites, belemnites, rudist and inoceramid bivalves, most planktic foraminifers, and all of the dinosaurs excluding the birds.[70]",https://en.wikipedia.org/wiki/Timeline_of_the_evolutionary_history_of_life,66000000,66000000
66000000,"Rapid dominance of conifers and ginkgos in high latitudes, along with mammals becoming the dominant species. First psammobiid bivalves. Earliest rodents. Rapid diversification in ants.",https://en.wikipedia.org/wiki/Timeline_of_the_evolutionary_history_of_life,66000000,66000000
67,The Caribbean monk seal goes extinct[78],https://en.wikipedia.org/wiki/Timeline_of_the_evolutionary_history_of_life,67,67
68000000,"Tyrannosaurus, the largest terrestrial predator of what is now western North America appears in the fossil record. First species of Triceratops.",https://en.wikipedia.org/wiki/Timeline_of_the_evolutionary_history_of_life,68000000,68000000
70000000,Multituberculate mammals increase in diversity. First yoldiid bivalves.,https://en.wikipedia.org/wiki/Timeline_of_the_evolutionary_history_of_life,70000000,70000000
750000000,First protozoa (ex: Melanocyrillium),https://en.wikipedia.org/wiki/Timeline_of_the_evolutionary_history_of_life,750000000,750000000
8000,The Giant Lemur died out,https://en.wikipedia.org/wiki/Timeline_of_the_evolutionary_history_of_life,8000,8000
8,The western black rhinoceros is declared extinct,https://en.wikipedia.org/wiki/Timeline_of_the_evolutionary_history_of_life,8,8
80000000,First ants,https://en.wikipedia.org/wiki/Timeline_of_the_evolutionary_history_of_life,80000000,80000000
800000,Short-faced bears (Arctodus simus) become abundant in North America,https://en.wikipedia.org/wiki/Timeline_of_the_evolutionary_history_of_life,800000,800000
83,"The thylacine goes extinct in a Tasmanian zoo, the last member of the family Thylacinidae",https://en.wikipedia.org/wiki/Timeline_of_the_evolutionary_history_of_life,83,83
740000000,"A global glaciation may have occurred.[48][49] Opinion is divided on whether it increased or decreased biodiversity or the rate of evolution.[50][51][52] It is believed that this was due to evolution of the first land plants, which increased the amount of oxygen and lowered the amount of carbon dioxide in the atmosphere.[53]",https://en.wikipedia.org/wiki/Timeline_of_the_evolutionary_history_of_life,740000000,740000000
9000000,First platypuses,https://en.wikipedia.org/wiki/Timeline_of_the_evolutionary_history_of_life,9000000,9000000
9500000,"The Great American Interchange, where various land and freshwater faunas migrated between North and South America. Armadillos, opossums, hummingbirds Phorusrhacids, Ground Sloths, Glyptodonts, and Meridiungulates traveled to North America, while horses, tapirs, saber-toothed cats, Jaguars, Bears, Coaties, Ferrets, Otters, Skunks and deer entered South America.",https://en.wikipedia.org/wiki/Timeline_of_the_evolutionary_history_of_life,9500000,9500000
90000000,"Extinction of ichthyosaurs. Earliest snakes and nuculanid bivalves. Large diversification in angiosperms: magnoliids, rosids, hamamelidids, monocots, and ginger. Earliest examples of ticks. Probable origins of placental mammals (earliest undisputed fossil evidence is 66 Ma).",https://en.wikipedia.org/wiki/Timeline_of_the_evolutionary_history_of_life,90000000,90000000
95000000,First crocodilians evolve,https://en.wikipedia.org/wiki/Timeline_of_the_evolutionary_history_of_life,95000000,95000000
1200000000,"Meiosis and sexual reproduction are present in single-celled eukaryotes, and possibly in the common ancestor of all eukaryotes.[44] Sex may even have arisen earlier in the RNA world.[45] Sexual reproduction first appears in the fossil records; it may have increased the rate of evolution.[46]",https://en.wikipedia.org/wiki/Timeline_of_the_evolutionary_history_of_life,1200000000,1200000000
1850000000,"Eukaryotic cells appear. Eukaryotes contain membrane-bound organelles with diverse functions, probably derived from prokaryotes engulfing each other via phagocytosis. (See Symbiogenesis and Endosymbiont). Bacterial viruses (bacteriophage) emerge before, or soon after, the divergence of the prokaryotic and eukaryotic lineages.[39] The appearance of red beds show that an oxidising atmosphere had been produced. Incentives now favoured the spread of eukaryotic life.[40][41][42]",https://en.wikipedia.org/wiki/Timeline_of_the_evolutionary_history_of_life,1850000000,1850000000
600,"The moa and its predator, Haast's eagle, die out in New Zealand",https://en.wikipedia.org/wiki/Timeline_of_the_evolutionary_history_of_life,600,600
